Task Name,Section/Column,Due Date,Status,Priority,Notes,Tags
First manual quality check,WEEK 1: Foundation Clean,2026-04-13,DONE,High,Open state JSONs. Are 10 algos running clean? Write quality_check_2026-04-13.md. Commit it. 20 minutes max.,"quality-check,weekly"
Get FRED API key,WEEK 1: Foundation Clean,2026-04-14,DONE,Critical,"Go to fred.stlouisfed.org. Register free account. Add to GitHub Secrets as FRED_API_KEY. Unblocks cardboard, liquor, misery immediately. Zero new code.","fred,unblocking"
Implement validate_nightly.py surface checks,WEEK 1: Foundation Clean,2026-04-14,DONE,Critical,"Use Directive 2 from Claude conversation. Surface checks: files exist, valid JSON, ran today, equity in range. Wire into daily_run.yml. Test --dry-run. Confirm runs at 6:30 PM.","validation,pipeline"
Confirm 3 FRED algos unblocked,WEEK 1: Foundation Clean,2026-04-14,DONE,High,"After adding FRED key: verify cardboard, liquor, misery algos auto-seed and run tonight. Check state files exist tomorrow morning.","validation,fred"
Add deep validation checks,WEEK 1: Foundation Clean,2026-04-15,DONE,High,"Add to validate_nightly.py: position math, trade log integrity, equity curve sanity, cross-algo snapshot count. Test on existing state files. Confirm alert email fires on failure.","validation,deep"
Confirm validation email alert works,WEEK 1: Foundation Clean,2026-04-15,DONE,High,Trigger deliberate validation failure in dry-run. Confirm email arrives. Subject: SURFACE VALIDATION FAILED.,"validation,email"
Blitzkrieg #1: Truck Tonnage algo,WEEK 1: Foundation Clean,2026-04-16,DONE,High,"FRED: TSIFRGHT + RAILFRTCARLOADSD11. EXPANSION->XLI/XLB/XLE, CONTRACTION->XLP/XLU/XLV. Register in registry.py. Test dry-run. 2-3 hours.","blitzkrieg,algo,fred"
Blitzkrieg #2: Misery Rotation algo,WEEK 1: Foundation Clean,2026-04-17,DONE,High,"FRED: UNRATE + CPIAUCSL. Delta signal: rising->defensive, falling->offensive. Monthly cadence. 2-3 hours.","blitzkrieg,algo,fred"
Blitzkrieg #3: Uber Mobility algo,WEEK 1: Foundation Clean,2026-04-17,DONE,High,pytrends: uber+lyft search volume weekly. 4-week rate of change. RISK_ON->XLY/XLK/XLF. pytrends already in requirements. 2-3 hours.,"blitzkrieg,algo,pytrends"
Deploy precompute_signals.py,WEEK 1: Foundation Clean,2026-04-18,DONE,Critical,Drop in repo root. Test: python precompute_signals.py --min-days 1 --dry-run. Fix imports. Wire into daily_run.yml after crazy_run.py. Add git add docs/signals to commit step.,"infrastructure,signals"
Verify docs/signals/*.json generating,WEEK 1: Foundation Clean,2026-04-18,DONE,High,"After 6:30 PM run: confirm NVDA.json exists, index.json exists, 500 ticker files written, generated date = today.","verification,signals"
Deploy signal_lookup.html,WEEK 1: Foundation Clean,2026-04-19,DONE,High,Drop in docs/. Test fetch /signals/NVDA.json locally. Verify Enter key and ?ticker= URL param work. Commit.,"frontend,public"
Make sure there are legal disclaimers everywhere,WEEK 1: Foundation Clean,2026-04-18,DONE,Critical,"Add master disclaimer, signal lab notice, performance disclosure, data disclaimer, and short inline disclaimer to public pages/generators. Keep wording simple and obvious: experimental research, not advice, no guarantees, data may be wrong/delayed, user responsible.","legal,disclaimer,public,trust"
V2 ARCH: Define public JSON schema,WEEK 1: Foundation Clean,2026-04-19,NEED,Critical,"PUBLIC signals JSON contains ONLY: id, name, sector_etf, direction, rank, spy_delta, days_running, short_description. NO trade history. NO equity curves. NO breakdown. Write schema doc and commit.","architecture,v2,security"
Quality check #2,WEEK 2: Blitzkrieg Phase 1,2026-04-20,DONE,High,Review 16 algos. Any validation failures? Review 60 auto-generated ideas. Rank survivors by buildability. Write quality_check_2026-04-20.md. 20 minutes.,"quality-check,weekly"
Filter 60 auto-generated ideas,WEEK 2: Blitzkrieg Phase 1,2026-04-20,DONE,High,"Kill: no URL, paid API >$100/month, updates <monthly, duplicate. Keep: free API confirmed, FRED/gov data, <100 lines, different ETF target.","pipeline,ideas"
Blitzkrieg #4: Yelp Closure Velocity,WEEK 2: Blitzkrieg Phase 1,2026-04-21,DONE,Medium,Yelp Fusion API free tier. Track permanently_closed status changes weekly. Add YELP_API_KEY to GitHub Secrets.,"blitzkrieg,algo,yelp"
Blitzkrieg #5: Job Posting Acceleration,WEEK 2: Blitzkrieg Phase 1,2026-04-21,DONE,Medium,FRED: JTSJOL (job openings). Rising postings in sector = expansion. Monthly cadence.,"blitzkrieg,algo,bls"
Blitzkrieg #6: Bankruptcy Filing Rate,WEEK 2: Blitzkrieg Phase 1,2026-04-22,DONE,Medium,FRED: BUSTHCONS. Rising bankruptcies = stress = defensive rotation. Monthly.,"blitzkrieg,algo,fred"
Blitzkrieg #7: Small Business Formation,WEEK 2: Blitzkrieg Phase 1,2026-04-22,DONE,Medium,FRED: SBUSV (small business optimism). Rising = expansion signal for XLY and XLF. Monthly.,"blitzkrieg,algo,fred"
Blitzkrieg #8: Patent Filing Velocity,WEEK 2: Blitzkrieg Phase 1,2026-04-23,DONE,Medium,USPTO bulk data free. Patent filings by tech sector. Rising = R&D expansion = XLK. Quarterly.,"blitzkrieg,algo,uspto"
Blitzkrieg #9: Credit Card Delinquency,WEEK 2: Blitzkrieg Phase 1,2026-04-23,DONE,Medium,FRED: DRCCLACBS. Rising delinquency = consumer stress = defensive. Quarterly.,"blitzkrieg,algo,fred"
Blitzkrieg #10: Consumer Sentiment,WEEK 2: Blitzkrieg Phase 1,2026-04-24,DONE,Medium,FRED: UMCSENT (U Michigan). Rising = XLY/XLK. Falling = XLP/XLU. Monthly.,"blitzkrieg,algo,fred"
Blitzkrieg #11: Retail Sales Momentum,WEEK 2: Blitzkrieg Phase 1,2026-04-24,DONE,Medium,FRED: RSXFS. 3M rate of change. Rising = XLY/XLK. Use release date not reference date.,"blitzkrieg,algo,fred"
Blitzkrieg #12: OpenTable Reservations,WEEK 2: Blitzkrieg Phase 1,2026-04-25,POSTPONED,Medium,POSTPONED - SCRAPPER. OpenTable data only accessible via scraping opentable.com/state-of-industry. No API.,"blitzkrieg,algo,opentable"
Blitzkrieg #13: Hotel Occupancy Rate,WEEK 2: Blitzkrieg Phase 1,2026-04-25,POSTPONED,Medium,POSTPONED - SCRAPPER. STR data is paid. AH&LA press releases require scraping. No clean API path.,"blitzkrieg,algo,hotel"
Build leaderboard.html,WEEK 2: Blitzkrieg Phase 1,2026-04-26,DONE,Critical,"Claude Code directive. Single HTML file. Dark theme. Reads docs/data/public/leaderboard.json. Hero section, sector heatmap, algo table with Biscotti special row, ticker teaser, mailing-list CTA. Mobile responsive.","frontend,public,marketing"
V2 ARCH: Create docs/data/public/ structure,WEEK 2: Blitzkrieg Phase 1,2026-04-26,DONE,Critical,"Create: docs/data/public/leaderboard.json, benchmarks/spy.json, benchmarks/qqq.json, signals/*.json, report/daily.json. Migrate from docs/signals/. Update precompute_signals.py paths.","architecture,v2"
Quality check #3,WEEK 3: Blitzkrieg + Kronos,2026-04-27,NEED,High,26 algos running. Any early patterns? Validation failures? Write quality_check_2026-04-27.md. 20 minutes.,"quality-check,weekly"
Blitzkrieg #14: Freight Rail Carloads,WEEK 3: Blitzkrieg + Kronos,2026-04-28,DONE,Medium,AAR weekly + FRED: RAILFRTCARLOADSD11. Pairs with Truck Tonnage for CONSUMER_SHIFT vs INDUSTRIAL_SHIFT.,"blitzkrieg,algo,aar"
Blitzkrieg #15: Electricity Consumption,WEEK 3: Blitzkrieg + Kronos,2026-04-28,DONE,Medium,EIA electricity adapter + crazy algo implemented. Requires EIA_API_KEY for live signal; records blocked if missing.,"blitzkrieg,algo,eia"
Blitzkrieg #16: Port Container Volume,WEEK 3: Blitzkrieg + Kronos,2026-04-29,DONE,Medium,Port of LA/data.lacity.org TEU adapter + crazy algo implemented. No key expected.,"blitzkrieg,algo,port"
Blitzkrieg #17: Airline Load Factor,WEEK 3: Blitzkrieg + Kronos,2026-04-29,DONE,Medium,BTS T-100 load-factor adapter implemented with Monthly Transportation Statistics airline traffic fallback/proxy. Crazy algo registered. No key expected.,"blitzkrieg,algo,bts"
Blitzkrieg #18: Housing Permit Velocity,WEEK 3: Blitzkrieg + Kronos,2026-04-30,DONE,Medium,FRED: PERMIT. Monthly. Rising = XLB/XLI/XLRE. One of the most reliable leading indicators.,"blitzkrieg,algo,fred"
Blitzkrieg #19: Mortgage Application Index,WEEK 3: Blitzkrieg + Kronos,2026-04-30,DONE,Medium,MBA weekly index. Free via FRED: MORTGAGE30US proxy. Rising = XLRE/XLF/XLB.,"blitzkrieg,algo,mba"
Kronos: Install and test locally,WEEK 3: Blitzkrieg + Kronos,2026-05-01,NEED,High,pip install torch transformers huggingface_hub. Download NeoQuasar/Kronos-mini. Verify RAM <2GB. Run prediction on XLK locally.,"kronos,infrastructure"
Kronos: Build scripts/kronos_nightly.py,WEEK 3: Blitzkrieg + Kronos,2026-05-01,NEED,High,"For each 11 ETFs: fetch 400 days OHLCV, run KronosPredictor.predict(pred_len=5), compute UP/DOWN. Compare to algo positions. Write docs/kronos/today.json and history.json.","kronos,pipeline"
Kronos: Wire into daily_run.yml,WEEK 3: Blitzkrieg + Kronos,2026-05-02,NEED,High,Add step after crazy_run.py. continue-on-error: true. Kronos must NEVER block main pipeline. Add torch/transformers to requirements.txt.,"kronos,pipeline"
Kronos: Verify first live run,WEEK 3: Blitzkrieg + Kronos,2026-05-02,NEED,High,"After 6:30 PM: confirm docs/kronos/today.json exists, 11 sector calls present, algo grades populated, main pipeline NOT blocked.","kronos,verification"
Buffer: fix any Kronos issues,WEEK 3: Blitzkrieg + Kronos,2026-05-03,NEED,Medium,Catch-up day. Fix Kronos memory issues. Review all 32+ algos. Quality check suspicious state files.,"buffer,kronos"
Quality check #4 — IMPORTANT,WEEK 4: Close Blitzkrieg,2026-05-04,NEED,Critical,30 days since April 6. First Tier 1 algos. Kronos patterns? Which algos agree/disagree with Kronos? Take 45 minutes. First real signal check. Write quality_check_2026-05-04.md.,"quality-check,weekly,milestone"
Blitzkrieg #20-21: Commodity signals,WEEK 4: Close Blitzkrieg,2026-05-05,DONE,Medium,"FRED: PCOPPUSDM (copper) + WPU081 (lumber). Rising copper=XLB/XLI, rising lumber=XLB/XLRE. Both free FRED.","blitzkrieg,algo,fred"
Blitzkrieg #22-23: Options signals,WEEK 4: Close Blitzkrieg,2026-05-06,DONE,Medium,CBOE free: put/call ratio daily + VIX term structure. High P/C = fear = defensive. CBOE publishes free CSV downloads.,"blitzkrieg,algo,cboe"
Blitzkrieg #24-25: SEC signals,WEEK 4: Close Blitzkrieg,2026-05-07,DONE,Medium,Insider buying velocity from SEC EDGAR Form 4. Cluster buying in sector = smart money. Dark pool from FINRA ATS data weekly.,"blitzkrieg,algo,edgar"
Blitzkrieg #26-27: Yield curve signals,WEEK 4: Close Blitzkrieg,2026-05-08,DONE,Medium,FRED: T10Y2Y (yield curve slope) + BAMLH0A0HYM2 (corp bond spread). Inversion = max defensive. Both weekly.,"blitzkrieg,algo,fred"
Blitzkrieg #28-30: From 60 ideas list,WEEK 4: Close Blitzkrieg,2026-05-09,DONE,Medium,Pick 3 best remaining from 60 auto-generated ideas. Target 40+ algos running by May 9.,"blitzkrieg,algo"
Build CSV download feature,WEEK 4: Close Blitzkrieg,2026-05-10,NEED,High,"V2 ARCH: CSV downloads served by Railway not GitHub Pages. Three files: signals_today.csv, trade_history.csv, algo_performance.csv. Railway /api/premium/download/{type}. Gate behind JWT.","frontend,premium,v2,railway"
V2 ARCH: Separate public/private artifact generation,WEEK 4: Close Blitzkrieg,2026-05-10,NEED,Critical,"scripts/publish_public.py: stripped fields, writes to docs/data/public/, commits to repo. scripts/publish_private.py: full data, stores to Railway/R2. Wire both into daily_run.yml.","architecture,v2,security,pipeline"
Quality check #5 — Go/No-Go checkpoint,WEEK 5: Marketing Planning,2026-05-11,NEED,Critical,35 days. First Tier 1 algos. Kronos patterns. HONEST: Do I have something worth launching? Write most detailed quality check yet.,"quality-check,weekly,milestone"
Build correlation analysis script,WEEK 5: Marketing Planning,2026-05-12,NEED,High,scripts/analyze_correlations.py. SPY correlation + Kronos correlation per algo. Flag >0.8 SPY. Write docs/analysis/correlations.json.,"analysis,signals"
Buy domain: crazystockalgo.com,WEEK 5: Marketing Planning,2026-05-13,NEED,Critical,"Buy on Cloudflare ($12/year). DNS: crazystockalgo.com -> GitHub Pages, api.crazystockalgo.com -> Railway. HTTPS via Cloudflare. Add custom domain in repo Settings -> Pages.","infrastructure,domain"
Set up Stripe account,WEEK 5: Marketing Planning,2026-05-14,NEED,Critical,"Pricing intentionally TBD until June. For now, wire products around mailing-list demand and test checkout plumbing only after final pricing is set.","stripe,payments"
Set up MailerLite,WEEK 5: Marketing Planning,2026-05-14,NEED,High,"Repo-side landing slot and MailerLite form action are wired. Still requires test signup confirmation, groups waitlist/free_tier/paid_tier verification, and July 1 Biscotti campaign.","mailerlite,email,marketing"
MARKETING: Write Biscotti origin email,WEEK 5: Marketing Planning,2026-05-15,NEED,Critical,"400 words. Subject: Why I named a trading algorithm after my dog. Last week of Biscotti, Medium article, Codex, pipeline, April 6. Save as drafts/biscotti_email.md","marketing,content,biscotti"
MARKETING: Write Reddit launch post draft,WEEK 5: Marketing Planning,2026-05-15,NEED,Critical,"Title: I ran 163 weird alt-data signals for 90 days alongside an AAAI 2026 AI model. 500 words. 3 best, 2 worst, Biscotti once, waitlist CTA. Save as drafts/reddit_launch.md","marketing,content,reddit"
MARKETING: Write homepage hero text,WEEK 5: Marketing Planning,2026-05-15,NEED,High,3 sentences. What it is. Why different. What it costs. Before you buy a stock check the signals. Save as drafts/homepage_hero.md,"marketing,content"
Update landing page with real content,WEEK 5: Marketing Planning,2026-05-16,NEED,High,"Update docs/landing.html: hero text, leaderboard teaser, MailerLite waitlist form embed. No public pricing until June.","frontend,public,marketing"
Quality check #6,WEEK 6: 50 Algo Milestone,2026-05-18,NEED,High,Correlation results. Signals >0.8 SPY? Retire publicly. Kronos grading: algos beating Kronos on disagreements = ALPHA bucket. Write quality_check_2026-05-18.md.,"quality-check,weekly"
Blitzkrieg #31-35: 5 new algos,WEEK 6: 50 Algo Milestone,2026-05-18,NEED,Medium,Target 45 algos by May 23. Focus on Kronos-uncorrelated signals. Physical economy preferred over financial data.,"blitzkrieg,algo"
V2 ARCH: Set up Railway API service,WEEK 6: 50 Algo Milestone,2026-05-19,NEED,Critical,"Create Railway account. Deploy FastAPI. Endpoints: POST /webhook, GET /unlock, GET /api/me/status, GET /api/premium/leaderboard, GET /api/premium/signal/{id}, GET /api/premium/ticker/{symbol}. ~150 lines Python.","architecture,v2,railway"
V2 ARCH: Stripe webhook to Railway,WEEK 6: 50 Algo Milestone,2026-05-20,NEED,Critical,"Wire Stripe webhook to Railway /webhook. Handle: checkout.session.completed (mark entitled), customer.subscription.deleted (remove). Test with Stripe test mode.","architecture,v2,stripe,railway"
V2 ARCH: Magic link session auth,WEEK 6: 50 Algo Milestone,2026-05-21,NEED,Critical,"Railway sets JWT cookie: csa_member=tier, csa_email=email, 31-day expiry. /unlock validates Stripe session, sets cookies, redirects to /app.html. /api/me/status returns tier.","architecture,v2,auth"
V2 ARCH: Premium Railway endpoints,WEEK 6: 50 Algo Milestone,2026-05-22,NEED,High,"Build all premium endpoints. Each reads from private artifact storage. All require valid JWT. Return full trade history, equity curves, breakdowns. Test each manually.","architecture,v2,railway,premium"
Post 50 algo milestone tweet,WEEK 6: 50 Algo Milestone,2026-05-23,NEED,Medium,"Twitter/X: 50 weird signals running live. Day 47. Some beating market, some getting destroyed. All public. Link. Short.","marketing,social,milestone"
Quality check #7,WEEK 7: Blitzkrieg Phase 2,2026-05-25,NEED,High,Retire first confirmed noise signals publicly (win rate <52% after 45 days). Document in quality check. First public retirement — important for transparency.,"quality-check,weekly"
Blitzkrieg #36-45: 10 new algos,WEEK 7: Blitzkrieg Phase 2,2026-05-25,NEED,Medium,Target 55 algos by May 31. Work through remaining 60-list ideas. Fix anything correlation flagged as noise.,"blitzkrieg,algo"
V2 ARCH: app.html paid content page,WEEK 7: Blitzkrieg Phase 2,2026-05-27,NEED,High,"docs/app.html. Static on GitHub Pages. On load: fetch /api/me/status from Railway. Not entitled: show paywall. Entitled: fetch /api/premium/leaderboard, render. Ticker lookup: /api/premium/ticker/{symbol}.","frontend,premium,v2"
V2 ARCH: Private artifact storage,WEEK 7: Blitzkrieg Phase 2,2026-05-28,NEED,High,V1: Railway filesystem. Plan Cloudflare R2 (free 10GB) if >50MB. Update publish_private.py to upload to R2. Railway fetches from R2 to serve premium endpoints.,"architecture,v2,storage"
Test complete payment flow end to end,WEEK 7: Blitzkrieg Phase 2,2026-05-29,NEED,Critical,Full test after June pricing is set: land -> mailing list/pricing CTA -> Stripe -> Railway /unlock -> cookie set -> app.html loads -> premium content visible. Cancel flow. Stripe test mode.,"testing,v2,stripe"
LAUNCH: First Reddit post,WEEK 8: First Reddit Post,2026-06-01,NEED,Critical,"Post to r/algotrading (primary), r/investing, r/stocks. Use May 15 draft. Show 3 best, 2 worst. Mention Biscotti once. Link to leaderboard. Waitlist CTA. Goal: 100 waitlist signups.","marketing,reddit,launch"
Monitor and respond to Reddit post,WEEK 8: First Reddit Post,2026-06-02,NEED,High,Respond to every comment. Don't pitch. Just talk. Track upvotes and clicks to leaderboard.,"marketing,reddit,community"
Blitzkrieg #46-55: 10 more algos,WEEK 8: First Reddit Post,2026-06-01,NEED,Medium,Target 65 algos by June 14. Quality over quantity now. Retire anything <55% win rate after 60 days before adding new ones.,"blitzkrieg,algo"
Quality check #8,WEEK 8: First Reddit Post,2026-06-07,NEED,High,Post-Reddit check. Waitlist signups? Questions from Reddit? Algo patterns worth highlighting? Write quality_check_2026-06-07.md.,"quality-check,weekly"
Send first waitlist email,WEEK 8: First Reddit Post,2026-06-08,NEED,High,"Subject: Week 1 update from the lab. What fired, what didn't, new algo, Biscotti position. Short. Human. No sales pitch. Via MailerLite.","email,marketing,mailerlite"
Quality check #9,WEEK 9: Weekly Email Cadence,2026-06-08,NEED,High,56 days. Tier 1 well established. ALPHA bucket signals identified. Which beat Kronos on disagreements? Feature these.,"quality-check,weekly"
V2 ARCH: Rate limiting on Railway,WEEK 9: Weekly Email Cadence,2026-06-09,NEED,Medium,100 requests/minute per user on premium endpoints. Simple in-memory counter. Prevents abuse.,"architecture,v2,security"
V2 ARCH: Replay-safe Stripe webhook,WEEK 9: Weekly Email Cadence,2026-06-10,NEED,High,Store processed Stripe event IDs. If event ID already processed: return 200 immediately. Prevents double-entitlement.,"architecture,v2,stripe,security"
V2 ARCH: Session expiry handling,WEEK 9: Weekly Email Cadence,2026-06-11,NEED,High,31-day cookie expiry. On expiry: frontend gets 401. Redirect to /subscribe. Magic link email renews cookie. No password needed.,"architecture,v2,auth"
V2 ARCH: Cancel flow,WEEK 9: Weekly Email Cadence,2026-06-12,NEED,High,Stripe customer portal for self-serve cancel. customer.subscription.deleted webhook removes entitlement from Railway storage. Graceful degradation.,"architecture,v2,stripe"
Quality check #10,WEEK 10: Second Reddit + Soft Launch,2026-06-15,NEED,Critical,70 days. PRE-LAUNCH CHECKPOINT. How many beating SPY? How many beating Kronos? HONEST: is this worth charging for and what should pricing be?,"quality-check,weekly,milestone"
Finalize pricing and create Stripe products,WEEK 10: Second Reddit + Soft Launch,2026-06-16,NEED,Critical,"Use June 15 quality check, waitlist traffic, signal quality, and subscriber intent to set final launch pricing. Create Stripe products/prices in test mode first, then live mode only after final review.","pricing,stripe,launch"
LAUNCH: Second Reddit post,WEEK 10: Second Reddit + Soft Launch,2026-06-15,NEED,Critical,"Title: 60-day update: the 12 signals that survived and why they're finding something real. Show Kronos comparison, win rates, ALPHA bucket. Goal: 200 waitlist total.","marketing,reddit"
Launch checklist: go live mode,WEEK 10: Second Reddit + Soft Launch,2026-06-16,NEED,Critical,Stripe live mode. Verify webhook production URL. HTTPS all pages. Mobile check. Disclaimer reviewed (Lowe v. SEC). Load test Railway 50 concurrent requests.,"launch,testing"
Build welcome email sequence,WEEK 10: Second Reddit + Soft Launch,2026-06-17,NEED,High,6 emails in MailerLite automation. Day 0: how to use. Day 3: Biscotti story. Day 7: biggest signal flip. Day 14: Kronos grading. Day 21: failures. Day 30: recap.,"email,marketing,mailerlite"
SOFT LAUNCH: Email waitlist,WEEK 10: Second Reddit + Soft Launch,2026-06-21,NEED,Critical,Email waitlist: Early access opens today. Use final June pricing only. Stripe checkout link. FIRST REVENUE. Track conversions.,"launch,marketing,stripe"
Quality check #11,WEEK 11: Fix Everything,2026-06-22,NEED,High,Post soft-launch. What did early access users say? What is broken? What confuses them? Write quality_check_2026-06-22.md with user feedback.,"quality-check,weekly"
Fix all soft launch bugs,WEEK 11: Fix Everything,2026-06-22,NEED,Critical,"THIS WEEK IS BUGS ONLY. No new features. No new algos. Fix what early access users report. Mobile, payment flow, Railway speed, missing data.","bugs,launch"
V2 ARCH: Error handling audit,WEEK 11: Fix Everything,2026-06-23,NEED,High,"Audit all Railway endpoints. Every endpoint: 401=not authenticated, 403=not entitled, 404=not found, 500=log+generic. Meaningful errors everywhere.","architecture,v2,errorhandling"
V2 ARCH: Logging setup,WEEK 11: Fix Everything,2026-06-24,NEED,Medium,"Structured logging in Railway. Log: every premium request (algo_id, tier, timestamp), every Stripe webhook, every auth failure. Use Railway built-in log viewer.","architecture,v2,logging"
Quality check #12 — GO/NO-GO,WEEK 12: LAUNCH WEEK,2026-06-29,NEED,Critical,THE BIG ONE. 83 days. How many Tier 1? Beating SPY? Beating Kronos? Is the story ready? Launch July 1 or push to August 1? Write most honest quality check ever.,"quality-check,weekly,milestone,launch"
Write final launch Reddit post,WEEK 12: LAUNCH WEEK,2026-06-30,NEED,Critical,"Title: Its live. 90 days of data. Here is everything. More data, more specific. Queue to post July 1 at 10am ET.","marketing,reddit,launch"
Pre-launch final checklist,WEEK 12: LAUNCH WEEK,2026-06-30,NEED,Critical,"Verify: Stripe live, both tiers checkout, Railway all endpoints return data, app.html loads paid content, CSV downloads work, MailerLite fires on signup, mobile works, disclaimer visible, domain resolves.","launch,testing"
LAUNCH DAY: Send Biscotti email,WEEK 12: LAUNCH WEEK,2026-07-01,NEED,Critical,9:00 AM ET. Send Biscotti origin email to full waitlist via MailerLite. Subject: Why I named a trading algorithm after my dog. This is the conversion email.,"launch,email,biscotti"
LAUNCH DAY: Post to Reddit,WEEK 12: LAUNCH WEEK,2026-07-01,NEED,Critical,"10:00 AM ET. Post final launch post to r/algotrading, r/investing, r/stocks.","launch,marketing,reddit"
LAUNCH DAY: Post to Twitter/X,WEEK 12: LAUNCH WEEK,2026-07-01,NEED,Critical,10:30 AM ET. Leaderboard screenshot + Biscotti equity curve. Its live. crazystockalgo.com. Short. Link. Done.,"launch,marketing,twitter"
LAUNCH DAY: Reply to everything,WEEK 12: LAUNCH WEEK,2026-07-01,NEED,High,Spend the day responding to Reddit and Twitter. Don't pitch. Be human. Let the pipeline run at 6:30 PM.,"launch,community"
Quality check #13 — first post-launch,WEEK 13-14: Post-Launch,2026-07-06,NEED,Critical,How many subscribers? Feedback? What is working? What is broken? First real revenue numbers. Churn. Write publicly.,"quality-check,weekly,postlaunch"
Fix post-launch bugs week 1,WEEK 13-14: Post-Launch,2026-07-06,NEED,High,Fix everything subscribers report broken. Talk to every subscriber personally. Ask what they want next. No new features yet.,"bugs,postlaunch"
Identify most requested feature,WEEK 13-14: Post-Launch,2026-07-10,NEED,High,Pick ONE thing to build next based on subscriber feedback. Better mobile? More algos? Alerts? Watchlist? Build that one thing only.,"product,postlaunch"
Quality check #14 — two weeks post-launch,WEEK 13-14: Post-Launch,2026-07-13,NEED,High,Subscriber count. Churn. Revenue. MRR. Is this working? What needs to change for August? Write honestly.,"quality-check,postlaunch,milestone"
July 15: First revenue milestone review,WEEK 13-14: Post-Launch,2026-07-15,NEED,Critical,Count subscribers. Calculate MRR. Compare to $10k/month Dec 31 target. What is the trajectory? Write the honest post-mortem and commit it.,"milestone,revenue,review"
Write cleanup/retention script for codegen and failed-intervention artifacts,OPS: Pipeline Hygiene,2026-04-27,NEED,Medium,Keep data/algos_codegen/structural_* and failed/intervention artifacts for now; write a retention script to archive or delete after review window.,"ops,cleanup,codegen,retention,autogen"
Review data/algos new-algo audit log and decide action,OPS: Pipeline Hygiene,2026-05-04,NEED,Low,"Figure out whether data/algos/new_algos.jsonl should stay as an audit trail, feed emails/content, move elsewhere, or be replaced by a cleaner registry/history mechanism.","ops,audit-log,cleanup,low-priority"
Enforce globally unique algo IDs across normal and crazy families,OPS: Pipeline Hygiene,2026-05-08,NEED,Low,"Prevent name/id collisions across normal and crazy algos so reports, content, and downstream products can rely on globally unique identifiers.","ops,registry,backtest,ids,low-priority"
